{
  "generated_at": "2026-07-04T02:06:49Z",
  "source": "reports/data-go-kr/anyang-www-verification.json",
  "provider": "data.go.kr",
  "registry": "data/data-go-kr.registry.json",
  "limit": 20,
  "truncated": false,
  "summary": {
    "total": 26,
    "verified": 0,
    "failed": 26,
    "skipped": 0,
    "unknown": 0
  },
  "groups": {
    "by_status": [
      {
        "key": "failed",
        "count": 26,
        "status": "failed"
      }
    ],
    "by_reason": [
      {
        "key": "anyang_request_failed",
        "count": 26,
        "reason": "anyang_request_failed"
      }
    ],
    "by_provider": [
      {
        "key": "anyang",
        "count": 26,
        "provider": "anyang"
      }
    ],
    "by_endpoint_host": [
      {
        "key": "www.anyang.go.kr",
        "count": 26,
        "host": "www.anyang.go.kr"
      }
    ],
    "by_kind": [
      {
        "key": "external_endpoint",
        "count": 26,
        "kind": "external_endpoint"
      }
    ]
  }
}
