{
  "generated_at": "2026-07-04T03:43:48Z",
  "source": "reports/data-go-kr/qia-verification.json",
  "provider": "data.go.kr",
  "registry": "data/data-go-kr.registry.json",
  "limit": 20,
  "truncated": false,
  "summary": {
    "total": 33,
    "verified": 33,
    "failed": 0,
    "skipped": 0,
    "unknown": 0
  },
  "groups": {
    "by_status": [
      {
        "key": "verified",
        "count": 33,
        "status": "verified"
      }
    ],
    "by_provider": [
      {
        "key": "mafra",
        "count": 31,
        "provider": "mafra"
      },
      {
        "key": "qia",
        "count": 2,
        "provider": "qia"
      }
    ],
    "by_endpoint_host": [
      {
        "key": "data.mafra.go.kr",
        "count": 31,
        "host": "data.mafra.go.kr"
      },
      {
        "key": "home.kahis.go.kr",
        "count": 1,
        "host": "home.kahis.go.kr"
      },
      {
        "key": "meatwatch.go.kr",
        "count": 1,
        "host": "meatwatch.go.kr"
      }
    ],
    "by_kind": [
      {
        "key": "external_endpoint",
        "count": 33,
        "kind": "external_endpoint"
      }
    ]
  }
}
